{
  "manifestVersion": "0.1",
  "moduleId": "rf.actuator.motor.tt_dc_pair",
  "moduleType": "actuator",
  "displayName": "TT DC Motor Pair",
  "bus": "mechanical",
  "capabilities": ["differential_drive_motion"],
  "requiresFirmware": ">=0.1.0",
  "compatibleRobotTypes": ["rover"],
  "safetyNotes": [
    "Run first drive tests with wheels raised.",
    "Verify left and right channel mapping before floor tests."
  ],
  "metadata": {
    "motorCount": 2
  }
}
